<?xml version="1.0" encoding="UTF-8"?>
<xsd:schema xmlns:xsd="http://www.w3.org/2001/XMLSchema">
    <xsd:element name="sistema" type="TSistema"/>
    <xsd:complexType name="TSistema">
        <xsd:sequence>
            <xsd:element name="computador" type="TComputador" />
            <xsd:element name="componentes" type="TComponentes" />
        </xsd:sequence>
    </xsd:complexType>
    <xsd:complexType name="TComputador">
        <xsd:sequence>
            <xsd:element name="componente" type="PComponente" maxOccurs="unbounded"></xsd:element>
        </xsd:sequence>
        <xsd:attribute name="descricao" type="xsd:string"></xsd:attribute>
    </xsd:complexType>
    <xsd:complexType name="PComponente">
        <xsd:sequence>
            <xsd:element name="componente"></xsd:element>
        </xsd:sequence>
        <xsd:key name="id">
            <xsd:selector xpath="./TComponentes/"/>
        </xsd:key>
    </xsd:complexType>
    <xsd:complexType name="TComponentes">
        <xsd:sequence>
            <xsd:complexType name="PCComponente">
                <xsd:element name="item" type="Titem"></xsd:element>
                <xsd:element name= "modelo" type="Tmodelo"></xsd:element>
                <xsd:element name="preço" type="Tpreço"></xsd:element>
            </xsd:complexType>
        </xsd:sequence>
        <xsd:attribute name="codigo"></xsd:attribute>
    </xsd:complexType>
    <xsd:simpleType name="Titem">
        <xsd:restriction base="xsd:string">
            <xsd:pattern value="Motherboard|Video Card|Sound Card|Monitor|CPU|HDD|DVD"/>
        </xsd:restriction>
    </xsd:simpleType>
    <xsd:simpleType name="Tmodelo">
        <xsd:restriction base="xsd:string">
            <xsd:pattern value="[A-Z|a-z|\s|-|0-9]{32}"></xsd:pattern>
        </xsd:restriction>
    </xsd:simpleType>
    <xsd:simpleType name="Tpreço">
        <xsd:restriction base="xsd:string">
            <xsd:pattern value="[0-9]*.[0-9][0-9]"></xsd:pattern>
        </xsd:restriction>
    </xsd:simpleType>
</xsd:schema>

